{"schema_version":1,"vendor":{"id":"amd","display_name":"AMD"},"generated_at":"2026-07-23T06:15:06.000Z","legal_documents":[{"legal_document_id":"license.1b56238b999d0db2b917ba0620129cbc9b6aef0c7f0464a181f4a372ba4f9728","kind":"license","title":"AMD FidelityFX SDK License","format":"text","file_name":"LICENSE.md","content":{"sha256":"1b56238b999d0db2b917ba0620129cbc9b6aef0c7f0464a181f4a372ba4f9728","size_bytes":1119},"object_key":"libraries/legal/sha256/1b56238b999d0db2b917ba0620129cbc9b6aef0c7f0464a181f4a372ba4f9728.txt"},{"legal_document_id":"license.24574816bc396473a2082ba50aef02640502395b7cdaca49ce3fafe4bf6447fc","kind":"license","title":"AMD FidelityFX SDK License","format":"text","file_name":"LICENSE.md","content":{"sha256":"24574816bc396473a2082ba50aef02640502395b7cdaca49ce3fafe4bf6447fc","size_bytes":1119},"object_key":"libraries/legal/sha256/24574816bc396473a2082ba50aef02640502395b7cdaca49ce3fafe4bf6447fc.txt"},{"legal_document_id":"license.6757f2fec461238da6f84f83536ec195e8c036b1773a06f6f34301b9ed8c0963","kind":"license","title":"AMD FidelityFX SDK License","format":"text","file_name":"LICENSE.md","content":{"sha256":"6757f2fec461238da6f84f83536ec195e8c036b1773a06f6f34301b9ed8c0963","size_bytes":60891},"object_key":"libraries/legal/sha256/6757f2fec461238da6f84f83536ec195e8c036b1773a06f6f34301b9ed8c0963.txt"},{"legal_document_id":"license.b1ff86575bba155d782c8d1f12b0ad07113ce7e62956fadc2169eba29048b966","kind":"license","title":"AMD FidelityFX SDK License","format":"text","file_name":"LICENSE.md","content":{"sha256":"b1ff86575bba155d782c8d1f12b0ad07113ce7e62956fadc2169eba29048b966","size_bytes":61309},"object_key":"libraries/legal/sha256/b1ff86575bba155d782c8d1f12b0ad07113ce7e62956fadc2169eba29048b966.txt"},{"legal_document_id":"license.be05d8cd5489deff924dbe91e0c5b8c0ff034d43cd11749bf9a67a0c38252b7b","kind":"license","title":"AMD FidelityFX SDK License","format":"text","file_name":"LICENSE.md","content":{"sha256":"be05d8cd5489deff924dbe91e0c5b8c0ff034d43cd11749bf9a67a0c38252b7b","size_bytes":1119},"object_key":"libraries/legal/sha256/be05d8cd5489deff924dbe91e0c5b8c0ff034d43cd11749bf9a67a0c38252b7b.txt"},{"legal_document_id":"license.d36e79d1ea4b5bd05da170f49764af898726c57aba70f354720d96c6a74b347d","kind":"license","title":"AMD FidelityFX SDK License","format":"text","file_name":"LICENSE.md","content":{"sha256":"d36e79d1ea4b5bd05da170f49764af898726c57aba70f354720d96c6a74b347d","size_bytes":60975},"object_key":"libraries/legal/sha256/d36e79d1ea4b5bd05da170f49764af898726c57aba70f354720d96c6a74b347d.txt"},{"legal_document_id":"notice.94401a90486d1b53b528bb7f845a7b8daf7227b60eb7c0fc3b8c5571ba202a27","kind":"notice","title":"AMD FidelityFX SDK Third-Party Notices","format":"text","file_name":"THIRD-PARTY-NOTICES.md","content":{"sha256":"94401a90486d1b53b528bb7f845a7b8daf7227b60eb7c0fc3b8c5571ba202a27","size_bytes":2441},"object_key":"libraries/legal/sha256/94401a90486d1b53b528bb7f845a7b8daf7227b60eb7c0fc3b8c5571ba202a27.txt"}],"artifacts":[{"artifact_id":"sha256:48f1e5888ba6a0a3d59a98b9751e37c392b0f7b8c223d0082d5c1f40642879d3","library_id":"amd_fidelityfx_denoiser_dx12","file_name":"amd_fidelityfx_denoiser_dx12.dll","file_version":"1.2.0.2740","architecture":"X64","dll":{"sha256":"48f1e5888ba6a0a3d59a98b9751e37c392b0f7b8c223d0082d5c1f40642879d3","size_bytes":13782280},"transport":{"compression":"zstd","object_key":"libraries/blobs/sha256/548029be760d1802845a801bcfe6e530515668ba2b79c1f40b08f5651203eeb3.dll.zst","sha256":"548029be760d1802845a801bcfe6e530515668ba2b79c1f40b08f5651203eeb3","size_bytes":2841188},"signature":{"status":"signed","subject":"CN=Advanced Micro Devices, O=Advanced Micro Devices, S=California, C=US","thumbprint":"33D35682079E201671B738B7209B4586103BC271","signed_at":"2026-06-11T13:24:02.000Z"}},{"artifact_id":"sha256:61bebc329bf126f96e46e642e41e661e70fc01fc060f5ac523c67867c8e71fb0","library_id":"amd_fidelityfx_denoiser_dx12","file_name":"amd_fidelityfx_denoiser_dx12.dll","file_version":"1.0.0.604","architecture":"X64","dll":{"sha256":"61bebc329bf126f96e46e642e41e661e70fc01fc060f5ac523c67867c8e71fb0","size_bytes":3699472},"transport":{"compression":"zstd","object_key":"libraries/blobs/sha256/60b60f8314ea657e1a1452bcc9f49d03f96ceea9e3bfb59dd6625d7cdb45c78a.dll.zst","sha256":"60b60f8314ea657e1a1452bcc9f49d03f96ceea9e3bfb59dd6625d7cdb45c78a","size_bytes":1275637},"signature":{"status":"signed","subject":"CN=Advanced Micro Devices, O=Advanced Micro Devices, S=California, C=US","thumbprint":"33D35682079E201671B738B7209B4586103BC271","signed_at":"2025-12-09T10:36:53.000Z"}},{"artifact_id":"sha256:f003e1298f7bc09e76578f995f64e46e6f5355f0597b88ff85e9a9922fdf92c6","library_id":"amd_fidelityfx_denoiser_dx12","file_name":"amd_fidelityfx_denoiser_dx12.dll","file_version":"1.1","architecture":"X64","dll":{"sha256":"f003e1298f7bc09e76578f995f64e46e6f5355f0597b88ff85e9a9922fdf92c6","size_bytes":3633936},"transport":{"compression":"zstd","object_key":"libraries/blobs/sha256/e2abac75b5ea520405cca3bdfaf8e4f79765a2b54db268a88a5cf9ebc23ca4e6.dll.zst","sha256":"e2abac75b5ea520405cca3bdfaf8e4f79765a2b54db268a88a5cf9ebc23ca4e6","size_bytes":1365621},"signature":{"status":"signed","subject":"CN=Advanced Micro Devices, O=Advanced Micro Devices, S=California, C=US","thumbprint":"33D35682079E201671B738B7209B4586103BC271","signed_at":"2026-03-20T16:18:41.000Z"}},{"artifact_id":"sha256:602d24510583b74e6a660241009ebe702f0578ada8e8cc76243b3b2d6cb51b79","library_id":"amd_fidelityfx_dx12","file_name":"amd_fidelityfx_dx12.dll","file_version":"1.0.0.36208","architecture":"X64","dll":{"sha256":"602d24510583b74e6a660241009ebe702f0578ada8e8cc76243b3b2d6cb51b79","size_bytes":6470360},"transport":{"compression":"zstd","object_key":"libraries/blobs/sha256/9ff39e8b2180a6f995da72ae6039937eee30439ff2a9ea6df2a8475eb0cd0d8b.dll.zst","sha256":"9ff39e8b2180a6f995da72ae6039937eee30439ff2a9ea6df2a8475eb0cd0d8b","size_bytes":1095834},"signature":{"status":"signed","subject":"CN=Advanced Micro Devices, O=Advanced Micro Devices, S=California, C=US","thumbprint":"33D35682079E201671B738B7209B4586103BC271","signed_at":"2024-06-07T13:56:11.000Z"}},{"artifact_id":"sha256:f94622aaf38f30faca1ebb79cf238d86420b214f944bf8d4b073757005ce168a","library_id":"amd_fidelityfx_dx12","file_name":"amd_fidelityfx_dx12.dll","file_version":"1.0.0.36752","architecture":"X64","dll":{"sha256":"f94622aaf38f30faca1ebb79cf238d86420b214f944bf8d4b073757005ce168a","size_bytes":6475992},"transport":{"compression":"zstd","object_key":"libraries/blobs/sha256/12ff838e5ab17db74b9e28c0b7e0d64c293c2a3f210e2c7075ed472e3edaf946.dll.zst","sha256":"12ff838e5ab17db74b9e28c0b7e0d64c293c2a3f210e2c7075ed472e3edaf946","size_bytes":1095061},"signature":{"status":"signed","subject":"CN=Advanced Micro Devices, O=Advanced Micro Devices, S=California, C=US","thumbprint":"33D35682079E201671B738B7209B4586103BC271","signed_at":"2024-07-23T11:25:53.000Z"}},{"artifact_id":"sha256:ad203ed7852933e3d2d5af3356019cce69fd99664e59e68614846ad4d89f6b76","library_id":"amd_fidelityfx_dx12","file_name":"amd_fidelityfx_dx12.dll","file_version":"1.0.1.40157","architecture":"X64","dll":{"sha256":"ad203ed7852933e3d2d5af3356019cce69fd99664e59e68614846ad4d89f6b76","size_bytes":6647504},"transport":{"compression":"zstd","object_key":"libraries/blobs/sha256/3211ebe68bc5bcc529d78e63d351cefce86d7c933f93650cc691168e6d68cd82.dll.zst","sha256":"3211ebe68bc5bcc529d78e63d351cefce86d7c933f93650cc691168e6d68cd82","size_bytes":1218949},"signature":{"status":"signed","subject":"CN=Advanced Micro Devices, O=Advanced Micro Devices, S=California, C=US","thumbprint":"33D35682079E201671B738B7209B4586103BC271","signed_at":"2025-02-27T11:30:58.000Z"}},{"artifact_id":"sha256:e27a4b58960d4fa008795a95b205dcd547af7dd0562e05c9ea9364cbaff3094a","library_id":"amd_fidelityfx_dx12","file_name":"amd_fidelityfx_dx12.dll","file_version":"1.0.2.38022","architecture":"X64","dll":{"sha256":"e27a4b58960d4fa008795a95b205dcd547af7dd0562e05c9ea9364cbaff3094a","size_bytes":6621392},"transport":{"compression":"zstd","object_key":"libraries/blobs/sha256/f6193c94cc1896ea2f9fe43be4ad70ad6fd7fb8ae7b4c72f1b76c9411280cf27.dll.zst","sha256":"f6193c94cc1896ea2f9fe43be4ad70ad6fd7fb8ae7b4c72f1b76c9411280cf27","size_bytes":1213788},"signature":{"status":"signed","subject":"CN=Advanced Micro Devices, O=Advanced Micro Devices, S=California, C=US","thumbprint":"33D35682079E201671B738B7209B4586103BC271","signed_at":"2024-10-10T09:40:39.000Z"}},{"artifact_id":"sha256:12a5081257ec95b0b53ad51b4a87fb3c03f97fe0bbb59f9496968f8d50ef93a6","library_id":"amd_fidelityfx_dx12","file_name":"amd_fidelityfx_dx12.dll","file_version":"1.0.1.41314","architecture":"X64","dll":{"sha256":"12a5081257ec95b0b53ad51b4a87fb3c03f97fe0bbb59f9496968f8d50ef93a6","size_bytes":6675664},"transport":{"compression":"zstd","object_key":"libraries/blobs/sha256/e8bdd23e1d04131efb41ff0e3a88c59adc6f1f45bb1c342cf9d1117f0b84a5c6.dll.zst","sha256":"e8bdd23e1d04131efb41ff0e3a88c59adc6f1f45bb1c342cf9d1117f0b84a5c6","size_bytes":1327601},"signature":{"status":"signed","subject":"CN=Advanced Micro Devices, O=Advanced Micro Devices, S=California, C=US","thumbprint":"33D35682079E201671B738B7209B4586103BC271","signed_at":"2025-05-07T13:17:26.000Z"}},{"artifact_id":"sha256:270b6298bfb87098cbe679c8f4535e17fd8954a1313292b1564e982b1e679a0d","library_id":"amd_fidelityfx_dx12","file_name":"amd_fidelityfx_dx12.dll","file_version":"1.0.1.38338","architecture":"X64","dll":{"sha256":"270b6298bfb87098cbe679c8f4535e17fd8954a1313292b1564e982b1e679a0d","size_bytes":6634192},"transport":{"compression":"zstd","object_key":"libraries/blobs/sha256/d2f29ed881072377b18007ad485379728bc109b43511631ee8175b9303cc1299.dll.zst","sha256":"d2f29ed881072377b18007ad485379728bc109b43511631ee8175b9303cc1299","size_bytes":1321828},"signature":{"status":"signed","subject":"CN=Advanced Micro Devices, O=Advanced Micro Devices, S=California, C=US","thumbprint":"33D35682079E201671B738B7209B4586103BC271","signed_at":"2024-10-24T09:03:57.000Z"}},{"artifact